{
  "catalogVersion": "1.0.0",
  "contentDigest": "b4f7fae7947938a13579e06ab50eecb4be5cf2b3fd982ab510f6323e3db15901",
  "items": [
    {
      "applicability": {
        "constraints": [
          "evidence-aware",
          "no-guaranteed-outcome",
          "cross-carrier"
        ],
        "deliverables": [
          "industry-cognition-map",
          "seven-day-validation-task"
        ],
        "excluded_constraints": [
          "guaranteed-growth-required"
        ],
        "experience_levels": [
          "beginner",
          "intermediate"
        ],
        "goals": [
          "industry-cognition",
          "career-entry",
          "creator-positioning"
        ],
        "identities": [
          "creator",
          "career-switcher",
          "brand-content-operator"
        ]
      },
      "completion_criteria": [
        "行业边界、价值链、核心机制与能力缺口均已形成判断。",
        "三条可能路径包含取舍、风险和待验证问题。",
        "只选择一个七天内可观察结果的验证任务。"
      ],
      "contentPath": "content/scenarios/creator-ip-industry-cognition.json",
      "deliverable": "行业认知地图 + 唯一 7 天真实验证任务",
      "governance": {
        "license": {
          "attribution": "入行365",
          "spdx": "CC-BY-4.0"
        },
        "maintainers": [
          "ruhang365-maintainers"
        ],
        "review": {
          "reviewed_at": "2026-08-12",
          "status": "approved"
        },
        "source": {
          "kind": "owned",
          "url": "https://github.com/ruhang365/ruhang365-router/blob/main/content/scenarios/creator-ip-industry-cognition.json"
        },
        "stale": false,
        "stale_after": "2026-11-12",
        "updated_at": "2026-08-12"
      },
      "id": "r365.scenario.creator-ip-industry-cognition",
      "match_terms": [
        "自媒体",
        "个人IP",
        "IP 行业",
        "一小时吃透行业",
        "转行创作者",
        "行业认知地图"
      ],
      "next_intent": "knowledge",
      "recommendation_weight": 20,
      "schema_version": "1.0.0",
      "slug": "creator-ip-industry-cognition",
      "status": "current",
      "summary": "在投入内容生产前，用公开结构和 RHZL 当前 Workflow 建立行业认知并选择一个七天真实验证任务。",
      "tags": [
        "自媒体",
        "个人 IP",
        "行业认知",
        "职业转型"
      ],
      "title": "一小时吃透自媒体 / IP 行业",
      "type": "scenario",
      "version": "1.0.0",
      "workflow_ids": [
        "r365.workflow.creator-ip-industry-cognition"
      ]
    },
    {
      "applicability": {
        "constraints": [
          "free-only",
          "no-private-data",
          "cross-carrier"
        ],
        "deliverables": [
          "customer-feedback-review"
        ],
        "excluded_constraints": [
          "contains-private-customer-data"
        ],
        "experience_levels": [
          "beginner",
          "intermediate"
        ],
        "goals": [
          "customer-insight",
          "service-improvement"
        ],
        "identities": [
          "local-business",
          "small-business-owner"
        ]
      },
      "completion_criteria": [
        "结论可以回溯到脱敏后的原始反馈。",
        "优势、问题和建议被明确分开。",
        "改进动作包含优先级与验证方式。"
      ],
      "contentPath": "content/scenarios/customer-feedback-review.json",
      "deliverable": "高频问题、真实优势和三条优先改进动作",
      "governance": {
        "license": {
          "attribution": "入行365",
          "spdx": "CC-BY-4.0"
        },
        "maintainers": [
          "ruhang365-maintainers"
        ],
        "review": {
          "reviewed_at": "2026-08-12",
          "status": "approved"
        },
        "source": {
          "kind": "owned",
          "url": "https://github.com/ruhang365/ruhang365-router/blob/main/content/scenarios/customer-feedback-review.json"
        },
        "stale": false,
        "stale_after": "2027-02-12",
        "updated_at": "2026-08-12"
      },
      "id": "r365.scenario.customer-feedback-review",
      "match_terms": [
        "门店",
        "小店",
        "咖啡店",
        "顾客评论",
        "用户反馈",
        "差评整理"
      ],
      "next_intent": "knowledge",
      "recommendation_weight": 10,
      "schema_version": "1.0.0",
      "slug": "customer-feedback-review",
      "status": "current",
      "summary": "把脱敏后的顾客评论整理成高频问题、真实优势和可以执行的改进动作。",
      "tags": [
        "本地生活",
        "顾客反馈",
        "服务改进"
      ],
      "title": "顾客反馈整理与改进清单",
      "type": "scenario",
      "version": "1.0.0",
      "workflow_ids": [
        "r365.workflow.customer-feedback-review"
      ]
    },
    {
      "applicability": {
        "constraints": [
          "low-budget",
          "no-private-data",
          "cross-carrier"
        ],
        "deliverables": [
          "product-visual-kit"
        ],
        "excluded_constraints": [
          "missing-product-facts"
        ],
        "experience_levels": [
          "beginner",
          "intermediate"
        ],
        "goals": [
          "visual-content",
          "product-promotion"
        ],
        "identities": [
          "local-business",
          "small-business-owner"
        ]
      },
      "completion_criteria": [
        "三个方向都说明用途、比例、准确文字与视觉重点。",
        "Prompt 只使用已确认的产品事实。",
        "用户能选择一个方向继续生成或交给设计师。"
      ],
      "contentPath": "content/scenarios/product-visual-kit.json",
      "deliverable": "3 个海报方向和 1 条可直接使用的任务专属 Prompt",
      "governance": {
        "license": {
          "attribution": "入行365",
          "spdx": "CC-BY-4.0"
        },
        "maintainers": [
          "ruhang365-maintainers"
        ],
        "review": {
          "reviewed_at": "2026-08-12",
          "status": "approved"
        },
        "source": {
          "kind": "owned",
          "url": "https://github.com/ruhang365/ruhang365-router/blob/main/content/scenarios/product-visual-kit.json"
        },
        "stale": false,
        "stale_after": "2027-02-12",
        "updated_at": "2026-08-12"
      },
      "id": "r365.scenario.product-visual-kit",
      "match_terms": [
        "门店",
        "小店",
        "咖啡店",
        "产品海报",
        "视觉素材",
        "商品图片"
      ],
      "next_intent": "visual",
      "recommendation_weight": 5,
      "schema_version": "1.0.0",
      "slug": "product-visual-kit",
      "status": "current",
      "summary": "围绕一个真实产品生成三个视觉方向和一条任务专属 Prompt，不虚构产品信息。",
      "tags": [
        "本地生活",
        "产品视觉",
        "海报",
        "生图"
      ],
      "title": "本地小店产品视觉素材包",
      "type": "scenario",
      "version": "1.0.0",
      "workflow_ids": [
        "r365.workflow.product-visual-kit"
      ]
    },
    {
      "applicability": {
        "constraints": [
          "free-only",
          "low-budget",
          "no-private-data",
          "cross-carrier"
        ],
        "deliverables": [
          "weekly-content-kit"
        ],
        "excluded_constraints": [],
        "experience_levels": [
          "beginner",
          "intermediate"
        ],
        "goals": [
          "content-growth",
          "customer-acquisition"
        ],
        "identities": [
          "local-business",
          "small-business-owner"
        ]
      },
      "completion_criteria": [
        "七条选题分别对应真实顾客问题或购买理由。",
        "至少一篇文案可以继续编辑和发布。",
        "封面方向包含准确文字、比例和视觉重点。"
      ],
      "contentPath": "content/scenarios/weekly-content-kit.json",
      "deliverable": "7 条可发布选题、1 篇完整文案和 1 个封面方向",
      "governance": {
        "license": {
          "attribution": "入行365",
          "spdx": "CC-BY-4.0"
        },
        "maintainers": [
          "ruhang365-maintainers"
        ],
        "review": {
          "reviewed_at": "2026-08-12",
          "status": "approved"
        },
        "source": {
          "kind": "owned",
          "url": "https://github.com/ruhang365/ruhang365-router/blob/main/content/scenarios/weekly-content-kit.json"
        },
        "stale": false,
        "stale_after": "2027-02-12",
        "updated_at": "2026-08-12"
      },
      "id": "r365.scenario.weekly-content-kit",
      "match_terms": [
        "门店",
        "小店",
        "咖啡店",
        "餐厅",
        "零售",
        "一周内容",
        "获客内容"
      ],
      "next_intent": "writing",
      "recommendation_weight": 20,
      "schema_version": "1.0.0",
      "slug": "weekly-content-kit",
      "status": "current",
      "summary": "把一家本地小店的真实卖点转成一周可发布内容，并明确首篇文案与封面方向。",
      "tags": [
        "本地生活",
        "内容运营",
        "获客",
        "小店"
      ],
      "title": "本地小店一周获客内容包",
      "type": "scenario",
      "version": "1.0.0",
      "workflow_ids": [
        "r365.workflow.weekly-content-kit"
      ]
    },
    {
      "applicability": {
        "constraints": [
          "evidence-aware",
          "no-guaranteed-outcome",
          "cross-carrier"
        ],
        "deliverables": [
          "industry-cognition-map",
          "seven-day-validation-task"
        ],
        "excluded_constraints": [
          "guaranteed-growth-required"
        ],
        "experience_levels": [
          "beginner",
          "intermediate"
        ],
        "goals": [
          "industry-cognition",
          "career-entry",
          "creator-positioning"
        ],
        "identities": [
          "creator",
          "career-switcher",
          "brand-content-operator"
        ]
      },
      "completion_criteria": [
        "固定九部分认知地图齐全且关键结论可回溯。",
        "没有把头部案例、市场增长或平台规则写成个体保证。",
        "下一步只有一个，并能在七天内留下可观察证据。"
      ],
      "contentPath": "content/workflows/creator-ip-industry-cognition.json",
      "estimated_minutes": 60,
      "goal": "在 45–75 分钟内形成可信行业认知地图并进入一个七天真实验证任务。",
      "governance": {
        "license": {
          "attribution": "入行365",
          "spdx": "CC-BY-4.0"
        },
        "maintainers": [
          "ruhang365-maintainers"
        ],
        "review": {
          "reviewed_at": "2026-08-12",
          "status": "approved"
        },
        "source": {
          "kind": "owned",
          "url": "https://github.com/ruhang365/ruhang365-router/blob/main/content/workflows/creator-ip-industry-cognition.json"
        },
        "stale": false,